Thème;Type;Question;A;B;C;D;Reponse
Tahiti;Duo;En 1998, quel concours national la Tahitienne Mareva Galanter remporte-t-elle ?;Les Dicos d`or;Le concours Lépine;Miss France;Le concours général;A
Tahiti;Duo;Quel mot issu du polynésien désigne le vêtement traditionnel que les Tahitiens nouent à la taille ? ;Tiaré;Paréo;Vahiné;Monoï;B
Tahiti;Carré;"En 1891, quel peintre se rend à Tahiti pour, dit-il, vivre ""d`extase, de calme et d`art"" ?";Auguste Renoir;Claude Monet;Paul Gauguin;Paul Cézanne;C
Tahiti;Carré;Un an après sa découverte par le capitaine anglais Willis, quel navigateur français réalisant un tour du monde arrive à Tahiti en 1768 ?;Dumont d`Urville;Bougainville;Kerguelen;La Pérouse;B
Tahiti;Cash;Quel adjectif, évoquant la manière dont on en joue, qualifie la flûte traditionnelle nommée vivo à Tahiti ?;;;;;
Tahiti;Cash;"Que désigne le mot roti dont dérive le surnom ""Loti"" donné par la cours d`une reine tahitienne à l`écrivain Pierre Loti ?";;;;;
